Story,Task,Estimate min (hr),Estimate max (hr),Actual,Comment
01 – research,learn enough to be able to plan a sprint. The outcome of this task should be a completed time estimate file.,none,none,5 days 12.26 – 12.30,Learning about prompt engineering and building LLM systems with langchain. Understanding vector stores and semanting space representations of text for running similarity search. Tinkering with python and langchain. Trying to build simple systems and understand the framework and workflows.
02 – Build Retriever,tinker with libraries and python code to build the simplest system that retrieves the relevan documents,,,4 days 01.02 – 01.05,
03 – Build LLM,Build the simplest system that answers questions based on retrieved relevant documents,,,1 day 01.06,
04 – Build Test site,Build the simplest client and server apps so users can query the llm from a client application.,,,,
05 – Deploy,Configure Nginx on the host machine and set up docker containers and docker-compose file. Set up production environment. Test,,,,
